{
  "generalInfo": {
    "externalSystemId": "12346-abcde-67890-fhhil",
    "firstName": "Joh",
    "preferredFirstName": "J",
    "middleName": "11",
    "lastName": "Doe"
  },
  "address0": {
    "addressLine0": "123 Main St",
    "addressLine1": "Apt 4B",
    "city": "Springfield",
    "province": "Illinois",
    "zip": "62704",
    "country": "USA"
  },
  "address1": {
    "addressLine0": "456 Elm St",
    "addressLine1": "Suite 5A",
    "city": "Springfield",
    "province": "Illinois",
    "zip": "62705",
    "country": "USA"
  },
  "contactInfo": {
    "phone": "555-1234",
    "mobilePhone": "555-5678",
    "email": "tst"
  },
  "preferredEmailCommunication": ["Programs"]
}
